listing_id,id,date,reviewer_id,reviewer_name,comments
18666,50158511,10-10-2015,1559265,Jody,Very nice flat. We had easy transportation to everywhere via the Metro. We could see Sagrada Familia from the terrace. Our hosts helped us with questions we had. Thanks!
18674,4808211,27-05-2013,4841196,Caron,"Great location. Clean, spacious flat. Would recommend to anyone."
18674,10660311,02-03-2014,11600277,Juan Carlos,"Mi mejor recomendación para este departamento. Cuida todos los detalles, adicionalmente muy cómodo, limpio, funcional y situado perfectamente. "
18674,41087522,04-08-2015,35231385,Shlomi,"Big apartment, well equipped.
Very good service, excellent location.
Recommended."
18674,81000756,20-06-2016,23223644,Joost,"The Check in was fast and flexible. The price is fair, because the flat ist big enough for 8 people if you are flexible as well. We were the in a time where it wasn't so hot outside, so I have no idea how hot it can get inside. This was my second Airbnb stay so I can't compare it so good with other apartments but I would wish me, that the owner, offers the guests more toilet paper  etc. . Because if it is a short stay, you don't want to buy all the staff in big packages. 


All in all we are very happy with this decision "
18674,278588962,18-06-2018,4756672,Marius,"Great location and enough space in the apartment for 7 people. Although the mattresses were a bit too soft and the house is quite noisy, its a solid choice for a big group of people for a weekend in barcelona."
18674,408388148,04-02-2019,118847863,Sonora,"Our experience here was mixed. 
The location of this flat is super close to La Sagrada Familia, and there are lots of cute restaurants and cafes nearby. 

The flat itself wad impersonal and not well represented by the photos. The folks who rent this spot have a bunch of other places in the city. So even though it was spacious, it lacked charm, and was heavily used without being heavily cleaned.

There were extra pillows, but no extra pillow cases; the one spare blanket was covered in unwashed food stains (as was the furniture); and while the large bed was comfy, the small bed I slept in felt like laying on a box filled with metal springs. 

I have an Airbnb if my own, and work very hard to accurately represent my space. It was disappointing not to find that to be the case here.

That said, check-in was easy, and when we had trouble with the heater, the response was quick."
23197,199839,15-03-2011,409630,Tim,"We (5 friends) were staying for a conference in the nearby center and were pleasantly surprised. The apartment was clean, quiet, modern and spacious. It had extensive commodities like laundry machines, fast internet, dish washer and a nice balcony.
I would definitely recommend it!"
23197,857673,11-01-2012,1594062,Aaron,The host canceled my reservation 138 days before arrival.
23197,40030652,27-07-2015,4933115,Thomas,We had a nice stay at the apartment. It is a 10 min walk to the beach and a 5 minute walk to a huge shopping center. The apartment is spacious and has a well equipped kitchen. We would stay there again. 
23197,48679422,28-09-2015,154018,Addison,"Great apartment! It was plenty spacious for us, and the balcony is just great. Tony was super helpful getting me oriented and giving us tips for our stay. We were going to a conference at CCIB, which is just down the street. Getting into the center was also very easy since we had a tram stop right in front of the building and a metro stop a short walk away. We would definitely stay there again in a heartbeat!"
23197,50292863,11-10-2015,11726135,Wallace,"I stayed in Marnie's apartment with two colleagues while attending a conference at the CCIB Centre in Barcelona. The apartment is lovely and very convenient to the Convention Centre. It's also a short walk to a shopping centre that has a supermarket. The apartment was very clean and well appointed. We felt very at home and there were even some Spanish beers left for us in the fridge.

I would be very pleased to stay again."
23197,58913119,05-01-2016,50658453,Alix,"L appartement est spacieux chaleureux, calme et bien équipé . Attention il est situé à Badalona assez loin du centre de Barcelone contrairement au posionnement annoncé sur la carte. Comptez 12 à 20 euros de taxi pour rejoindre le centre. La place plus la place de parking en sous sol n est pas non plus comprise dans le prix ce qui est un peu mesquin à  mon goût vu les tarifs pratiques mais on s est quand même bien amusés."
23197,63802917,27-02-2016,29124245,Daniel,"The apartment was great! Convenient location, really clean, and there was even a bottle of wine waiting for us!"
23197,73435617,08-05-2016,60518621,Travis,"The Forum Deluxe apartment hosted by Etain was excellent, overall.

A group of 4 colleagues stayed in this apartment during our business trip to the Barcelona CCIB conference center and were very pleased with our stay.

Pros:
- very close (5 min walk) to the CCIB conference/convention center and beach
- very clean and well-equipped, modern apartment which has been accurately advertised by the host
- local area felt safe
- 4 physical beds for 4 individual sleeping arrangements (2 double options available for a total of 6 bed spaces)--as advertised
- We were able to reserve the entire apartment with only 4 guests

Suggested improvements:
- we experienced some timing/coordination inconvenience due to having only 2 apartment keys. This could easily be resolved if the host can provide 1 key/guest as-needed, especially for business travelers. Note: the apartment host (Etain) has been excellent and we expect this accommodation will be made.
- we were not initially aware of an additional, cash-only fee (""tourist tax"") which was requested during check-in. Rate was .72 x person x night and was rounded up to nearest Euro. E.g., total for our 4 person, 5 night stay was 15 Euro.
"
23197,86089088,14-07-2016,61965582,Annichen,"Great apartment, wounderful host and nice safe area. A bit further outside city center than we thought but easy to catch tram or metro. We might come again "
23197,87576557,20-07-2016,70806092,Tim,The apartment was absolutely beautiful! Perfect for our family. It was close to the metro and an easy walk to Diagonal Mar mall and lots of restaurants. Communication with our host was very helpful before and during our stay. We highly recommend this apartment for an awesome stay in Barcelona!
23197,93939986,14-08-2016,72514078,Flora,"Litt vanskelig å finne stedet, og drosjesjåføren slet litt, men vi ble møtt. Leiligheten var som den ble beskrevet, og alt fungerte fint. Fin terasse, men det er  noe bråk fra veien (selv om det ikke er den mest trafikerte veien i byen). Vi fikk frastjålet en sykkel fra gaten. Stod låst, men var borte på 10 minutter. Det skjer overalt i Barcelona, og var en påmindelse om at man bør passe på spesielt i Metro osv. 
Ellers går trikken rett utenfor leiligheten og det er lett å komme seg til byen eller standen. "
23197,98968732,02-09-2016,27763084,Nigel,"We had a wonderful 8 day stay at this apartment. We were attending a convention at the CCIB which is ~700m away  (an easy stroll) and we had a 5y old with us. 

We liked:
a) presence of a supermarket and a mall 700m away
b) easy tram access (50m away) & metro access (650m away) at El Maresme/Forum stop
c) lots of food around the metro stop and at the mall
d) very clean , well-kept apartment with all modern conveniences, great layout with a lovely balcony to sit in. The memory foam pillows in the master bedroom were a plus!
e) cool sea breeze throughout the day blowing thru the apartment, which was good for hot summers
f) Etain was also very responsive, and although she was away while we were in Barcelona, another person was there to help us settle in, and also to check out.

Overall, a very comfortable stay, in a lovely modern apartment. Two thumbs up!"
23197,110841659,28-10-2016,69414118,Andrius,Fantastic experience! Very easy to get to! Very close to the L4 Metro from Fórum to get into the city. Get the T-10 ticket if you plan to take the metro more than a few times. The apartments was fantastic! I was in town for 2 weeks and did a load of laundry and having a dryer was a rarity in the area. Everyone was friendly and welcoming. The entire experience was 5-stars!
23197,124554547,02-01-2017,16921190,Gabriel,"Good place, 

Excellent host.

I'll book it again next time I'll go to Barcelona"
23197,134974650,02-03-2017,52569384,Sema,"Great apartment, very clean and lots of space."
23197,143913329,14-04-2017,61010096,Samanta,"The place was as described and more. They accommodate out check in time. We were received by Tony who was wonderful. He gave us tips of places to go during our stay. Also, we had cold beverages waiting for us which it was a nice touch. The place was perfect. We were located at a first floor and with a beautiful balcony. In overall, I recommend this place to anyone who visits Barcelona. "
23197,150631225,08-05-2017,89754617,Alice,"Etain was an excellent host. Great communication from the start. The apartment is a beautiful, clean and spacious. The location was perfect for us, not in the hustle and bustle of the city and just a short public transport journey in. There is a tram stop just outside the door of the apartment. I can't recommend this apartment enough. Thankyou Etain for making our stay in Barcelona amazing! We will definitely be back. "
23197,154362623,24-05-2017,23537225,Cecilia,The place looks exactly as pictures. It is quite and even though is not centrally located public transportation and a complete shopping mall is 5 minutes away on foot . It was easy to communicate with the host and she was very helpful . 
23197,156578075,31-05-2017,90773973,Lauren,"We had a great week at Etain's place. This apartment is the perfect spot to stay if you are attending a function at the ICC. It was walking distance from the conference venue and right across the road from public transport, which made it really easy to get anywhere in Barcelona. There is a big shopping mall just down the road- very convenient."
23197,164834566,29-06-2017,137641361,Martin,The host canceled this reservation 335 days before arrival. This is an automated posting.
23197,166983841,05-07-2017,656553,Rene,"This place is perfect for 3-4 people. It is located on outskirts of BCN near the beaches, and central to public transport. There is a large mall nearby that has anything you may need. All in all a solid place for a very reasonable price!"
23197,172816547,22-07-2017,3472883,Emily,"Well located airbnb right next to the tram and perfect for those attending a conference at the CCIB. Recommend Sabor Mudejar as a nice neighborhood tapas place.

Note to future guests: the AC is now only in the living room and while there are fans in all the bedrooms it was pretty warm in July and even with the door open and fan in the hall way to try to blow in some cool air it was a little toasty some nights. 

Would absolutely stay again but maybe not in July."
23197,183421661,17-08-2017,127721196,Joanne,"Lovely apartment in a quiet residential area. Easy access to the main Barcelona attractions via the nearby Metro station or the tram, which stops right outside the apartment. Just a 10 minute walk to a large shopping centre, which contains a supermarket, retail shops and restaurants. We preferred to eat at the local bars, which we found good value and decent quality. All in all we had a great stay and we would definitely recommend this apartment."
23197,197359439,25-09-2017,36204102,Robert,Wonderful apartment -  easy metro access to downtown.
23197,200448257,05-10-2017,151833917,Jose Luis,"El apartamento es tal como se describe. Muy cómodo, con una gran terraza, todo el menaje necesario  y muy limpio. Tony nos recibió a la llegada muy atentamente explicándonos varios temas sobre comunicaciones, lugares de interés, etc. Tanto Etain como Tony nos han atendido en todo momento fantásticamente, ayudándonos en cualquier necesidad. Sin duda a nuestra vuelta a Barcelona intentaremos reservar en este mismo lugar situado fuera del bullicioso centro, muy bien comunicado y en zona muy, muy segura."
23197,248778802,01-04-2018,86452262,Csaba,"Marnie's place is a clean, spacious, cozy and well located apartment in Barcelona. It is far from the noisy streets, close to a port and beaches. As we have been traveling to the northern area of Spain each day the location fitted for us perfectly. Marnie has been always very communicative, helpful and lovely with us. The arrival went smoothly, we haven't got any bad surprises. Thank you, Marnie again! :-)"
23197,269233152,27-05-2018,29476632,Pbrenner46,"The photos do not do justice to Etain’s apartment, which is spacious, bright, and comfortable. The beds are excellent, the furniture is very good, and the apartment features high quality appliances, a plentiful supply of dishes, silverware and cooking utensils, good wi-fi, and a lovely balcony. The location is great if you are attending an event at the Forum (about an 8-minute walk from the apartment) or want to be near the water. It was also quite good for exploring Barcelona, because the T4 tram stops 30 meters from the front door of the building and connects you easily to the L4 subway line. The nearest subway station is about a 10-minute walk. There are small food markets nearby, and a super large supermarket in the Diagonal Mall, about a 12 minute walk. (But it is easy enough to hop on the tram at the Mall and go two stops to the apartment.) My group consisted of 4 adults, three of whom stayed in the apartment for a very pleasant week. We would do so again the next time we are in Barcelona."
23197,277908334,17-06-2018,166538847,Andrew,Lovely apartment close by to everything 
23197,286862435,07-07-2018,7470721,Aditya,Etain's apartment is large spacious and exactly as mentioned in the listing. It is 5 mins from the convention centre so perfect for anyone who is in town for a congress. I would highly recommend staying here. 
23197,289882160,13-07-2018,67337908,Vittorio,Excellent solution when attending conferences in the nearby Centre Convencions Internacional Barcelona.
23197,293802391,21-07-2018,184751401,Veronika,-
23197,303882083,08-08-2018,116100564,Anamaria,"Spacious apartment in a quiet residential area. Easy acces to the seaside and the main Barcelona attractions. Just a 10 minutes walk to a shopping center, Diagonal Mar. All in all we had a great time and we recommend the apartament. "
23197,334812300,10-10-2018,167671739,Raymond,Highly recommend! Just the right distance from all the hustle and bustle. Tram stop is 100 feet from the front door and provides easy access into the heart of the city within 10 minutes. The apartment is clean and well maintained.  Lots of space to entertain in living and dining area and the added benefit of a spacious balcony.
23197,336214681,14-10-2018,93208215,Emmanuel,"Great place and great host.  Very responsive and helpful.  Place is very spacious and located across the street from a tram stop.  If you learn the very useful and easy metro/tram/bus combo to get around Barcelona, you can get anywhere from this location."
23197,365455559,01-01-2019,220992441,Rafael,"El departamento cuenta con todo lo necesario para  6 personas.
La ubicación es excelente, tal cómo se menciona. El transporte público,  una maravilla a la puerta.  Fueron muy gentiles con un early check in y un late check out sin costo.  Pasamos una semana inolvidable en familia. Para mejorar, la cama matrimonial. Volveré a Barcelona, sin duda alguna. Rafael, Santiago de Chile"
25786,77146,11-08-2010,191524,Sammy And Dina,"Pedro is an intelligent, sensitive and kind young catalan. A cool cat, one might say. He reached out to us when we were really in a bind and invited us into his home despite the last minute request and the late hour. His apartment is clean, warm and friendly with a state of the art bathroom facility. Great guy that I highly recommend! "
25786,89965,04-09-2010,169957,Krishna,"I had a REALLY GREAT time with Pedro! He is extremely nice and his apartment is beautiful. I had a very comfortable room for myself, and Pedro generously let me use his kitchen. The location is just perfect - it is in the very central location and very close to 3 subway stations. I absolutely loved my stay in Barcelona. I would definitely recommend staying with Pedro!"
25786,102942,22-09-2010,218749,Molly & Charlie,Pedro's place is very comfortable and has all the essentials you need to travel.  He made sure we were comfortable and the location is convenient for the metro and is very active.  It is close to many restaurants and internet cafes and is within walking distance to the major Barcelona attractions.  Given all the wonderful activities within the area the noise level was a bit much for the light sleeper but we would highly recommned this place. 
25786,230882,18-04-2011,499814,Raphaël,"Pedro was very welcoming and nice, his flat is sunny and wonderfully situated, I strongly recommend him !"
25786,251270,04-05-2011,220142,Antonia,Friendly and inviting home. Conveniently located to the 5th Avenue shops and metro. I will definitely stay at Pedro's house again as he is a wonderful host.
25786,272147,20-05-2011,526458,Alexa,"Pedro Pérez me recibió en su casa como si yo pertenecía a su propia familia.
Una estancia inolvidable !!

Alexa y  Romano"
25786,290618,31-05-2011,527510,Maxim,Pedro was very nice and friendly. He has exceptional music taste. Location is perfect. Very comfortable room. I highly recommend Pedro's place. 
25786,305553,09-06-2011,504308,Elena,"Pedro is great host, provided us with all required things. Apartment location is perfect. Recommended!"
25786,310246,12-06-2011,650004,Cm,"
Pedro is a warm host and interesting to talk to.  He is very flexible with the arrangements.  There are some bars right below but I think the noise is not any worse than most places in Barcelona.  The area has lots of nice shops and restaurants and it is also convenient to the central tourist spots.  "
25786,316777,15-06-2011,679912,Wentao,pedro was a great host. i really enjoyed the stay with him.
25786,326695,21-06-2011,612522,Diana,My heart remains in Barcelona! Pedro I miss you))
25786,329189,22-06-2011,215000,Carmen,"Nice place, nice host.
Close to everything.
:)"
25786,334880,26-06-2011,67243,Nana,"Thank you Pedro! Wonderful apartment in the best neighborhood of Barcelona. Everything was really clean and Pedro is very easy going and trusting. Apartment is on the first floor so it has easy access, and the room has a balcony. Towels, sheets provided. Very nice place."
25786,349252,03-07-2011,528643,Vincent,We were very happy of our stay at Pedro's place. Pedro had a real concern for our well being. The flat is clean and functional and very central in barcelona. The metro Diagonal is situated at 5min by foot. Pedro is a great host and is a great person.
25786,360654,08-07-2011,689213,Dasha,"everything was ok) Pedro is a really nice guy,  a room is ok, clean and destination is in a good place in Barcelona) "
25786,364301,10-07-2011,697061,Emily,"Pedro was a great host, very helpful and friendly.  His flat is in an excellent location which made it easy to make the most of my time in Barcelona.  Thanks for a memorable stay Pedro!"
25786,374431,15-07-2011,741369,John,Great place. Great host.
25786,398161,26-07-2011,371781,Vanessa,Pedro is a wonderful guy and his apartment is very nice and in my favorite neighborhood in Barcelona.
25786,416568,02-08-2011,648941,Allegra,"Staying with Pedro was very easy and enjoyable. He is a welcoming host and his flat is in an excellent location, close to restaurants and bars and away from the tourist strip. The apartment is very clean and Pedro is happy to help with questions about Barcelona, maps etc. "
25786,420349,04-08-2011,340045,Laura,"A comfy bed, a very gracious host, and an excellent location. What more could you want?"
25786,424240,06-08-2011,788488,Maria,Pedro is a very friendly host. We arrived very late and that was ok. The room is small but clean and nice. The location of the appartment is perfect for going out in the night and having some drinks. 
25786,434959,10-08-2011,718381,Valeri,"Pedro is a nice guy, friendly and helpful. We got very early flight. He help us to get a taxi. Small but clean room, great location."
25786,444780,14-08-2011,151007,Naty,"Pedro  es una magnifica persona y muy buen anfitrion. El lugar es para destacar ya que esta situado en el barrio Gracia, lugar tipico de Barcelona en donde las personas son del lugar y no turistas.
Muchas gracias Pedro por todo."
25786,500135,04-09-2011,414809,A. Patricia,"Pedro is really easy-going and nice. He helped me get all of my suitcases up the stairs since there was no elevator in the building. He also gave me some good advice for getting around and for living in Spain generally speaking. Also, the area is great. He is in the heart of Gracia so close to a lot of fun shops, cafes, and public transportation. The only thing is that the neighborhood can be a little noisy at night. Also, there is in an internet cafe around the corner since there is no internet in the apartment itself. "
25786,1119474,12-04-2012,384120,Laura,"We really enjoyed our time in BCN and at Pedro's. His flat is simple, pleasant, comfortable, and clean. And he is lovely-- very relaxed and welcoming. We instantly felt comfortable and really enjoyed our chats with him. He made some great recommendations for food in his neighborhood. We loved Gracia as well-- perfect place to explore this lovely city. "
25786,1281894,14-05-2012,481080,Hoi-Kee,Pedro is a warmhearted and flexible person. His house is special and clean. We had a wonderful time in Barcelona!
25786,1322419,21-05-2012,2358518,Jordan,Pedro was awesome! The location was fantastic and I would highly recommend it to anyone! Enjoy
25786,1492450,16-06-2012,2420532,María,"Alojamiento, ubicación, ambiente y anfitrión IDEAL. Por supuesto, repetiré."
25786,1507105,18-06-2012,2438818,Anki,"We had a very nice, but short stay in Barcelona. We enjoyed very much to meet Pedro, and got an instant liking to him. Friendly, open, sincere...
The flat has a great location in a more bohemian area of the city. Pedro couldn't be there when we arrived, but arranged very smoothly for someone to come and open up for us. Communication was quick and clear. "
25786,1519898,19-06-2012,704098,Dennison,"Pedro's place is in a super location, really pleasant and enjoyable. Tranquil with a lovely square downstairs- plenty of great restaurants and bars. A comfortable bed and a lovely little balcony overlooking the street.  I recommend! "
25786,1530715,21-06-2012,2518865,Dmitrii,Everything was great! Highly recommended!
25786,1623823,03-07-2012,2645666,Anastasia,"Pedro was very welcoming and helpful! The room was perfect, just the right size with all that you need. The apartment is located right next to the Placa Gracia which makes it very easy to get to many of the beautiful sights of Barcelona. I would recommend his room and I will definitely try to return in the future. Gracias por todo Pedro!"
25786,1658317,08-07-2012,140458,Marie-Anne,I had a really good time staying at Pedro's! I learnt a lot from our interesting conversations - thanks Pedro! The apartment is well located and clean. Pedro is very respectful and accommodating. I would definitely recommend!
25786,1975782,13-08-2012,2653558,Kevin,"Stayed for 3 nights (Thu, Fri & Sat) and left very pleased with both the room and the host.

The room is on a somewhat quiet, tiny little road located within 5 minutes walk from Fontana and Diagonal subway stations (both on the L3 green line), although you can easily walk through Passeig de Gràcia right to Plaça de Catalunya and beyond. I barely heard any noise during the night; woke up on Friday to some lovely opera being played in the neighbourhood, and on Saturday to some smooth jazz.

The bed is comfortable, but lacks a sommier (I actually prefer to sleep that way). A set of clean sheets and towel can be found on the bed as soon as you arrive. To battle the heat, you can either sleep with the balcony door open or use the fan provided in the room. A chair, mirror and small table with drawers are also included for your personal use.

The shower & WC is clean and work as expected. I didn’t use the kitchen so I can’t comment on that aspect of the house.

Pedro is a fantastic host and a unique individual, very easygoing and a pleasure to talk to. He couldn’t be present at the time of my arrival, but promptly arranged for someone to be ready to open the house and show me around.

Barcelona is an amazing place and this room is a superb choice with good value for money. I’ll definitely stay here again in future visits to the city!"
25786,4812981,27-05-2013,2805388,Elisa,"Great location, ambiance and prize. Pedro was kind and make us feel at home.  What else do you need?"
25786,4894464,31-05-2013,6484481,Nanna,"I reallt enjoyed my stay at Pedro's. He is very welcoming, which is nice when you arrive in a foreign country. The apartment is very well-located - with a bit of noise. Not more than you can expect, when you live in the city. Really nice neighborhood. 

We had great talks every evening - he is a really nice guy and very interesting to talk to. 

All in all I had a really nice stay, and I can only recommend Pedro. "
25786,5103381,12-06-2013,6221982,Stephanie,"Really nice experience. Pedro's Flat is really well situated, right in a heartful area of Barcelona, with a easy access to centre. Pedro is a really nice host looking to make sure you have a nice stay. The bed is confortable, the room is slightly small but it is enought for a weekend away.

Thank you Pedro, Stephanie"
