listing_id,id,date,reviewer_id,reviewer_name,comments
32471,299018568,30-07-2018,172637868,Karsten,"Wow! The views from both terraces are extraordinary and covers most of the city. The flat it self is nice, clean and perfectly cut for 4 persons. The fifth bed is a single bed in a little tight room with poor ventilation. We used the room only for storage. 
The kitchen is very nice and we recommend to use it and sit on the terrace and eat.
Around the neighborhood you will find plenty of grocery shops and restaurants. The metro is only 10 minutes walk away. The Park Güell (Gaudi) is just 15 minutes walk away.

In Danish: Anbefales!! Fin lejlighed med super beliggenhed. Vi er to voksne og to teenagers. Lejligheden er slidt men alt virker og køkken og bad er nyere. Vær opmærksom på at gæsteværelset ikke er velegnet til andet end opbevaring og omklædning. Den nederste terrasse er i tilknytning til stue og køkken og har et fint bord med stole til fire personer. Vi brugte den hver dag både morgen og aften. Den øverste terrasse har fuld sol hele dagen og bliver meget varm. Perfekt til solbadning og eventuelt en eftermiddags-drink. 
Lejligheden har opvaskemaskine og vaskemaskine. Det store badeværelse har en super bruseniche. Der var fint med sengelinned og håndklæder til alle. Lejligheden administreres af ""Friendly Rentals"" og det er der man henter nøglen. Til gengæld skal man ikke tilbage med nøglen ved ud checkning. Der forlader man lejligheden og smækker døren. Det er fint.
OBS: Naboerne er meget tæt på og der er stilleperiode fra klokken 22 til 08, i henhold til kontrakten. Naboen bad os om ikke at bruge den øverste terrasse om aftenen fordi det forstyrrede. Men der er generelt en meget fin service i butikker og ved attraktioner. Og de fleste beboere kan tale engelsk, hvis de vil.
Transport: På baggrund af bedre ankomst- og afrejsetider i Barcelona valgte vi at køre til Hamborg og flyve med Vueling (stort spansk flyselskab). Vi bestilte parkering online og det virkede perfekt.
Fra lufthavnen i Barcelona brugte vi bussen ""Aerobüs"" til Placa Catalunya og gik til kontoret for at få nøglen. Derfra tog vi taxa til lejligheden (15 EUR). Ellers anvendte vi metroen og købte 3-dages kort til 22,- EUR per styk i automaterne på stationerne.
Vi gør det gerne igen!!
 
"
32471,301332408,04-08-2018,4466291,Thomas,"Everything is as pictured, and the view from the back balcony is truly impressive. The Gràcia neighborhood is homey and tranquil in the evenings, making it the perfect landing after spending the day out and about in the downtown area."
32471,402083875,17-01-2019,5578224,Kenneth,"This is a great apartment in a wonderful, quiet location, halfway between Parc Guell and La Sagrada Familia. The views from the two terraces are incredible and expansive, not possible to fully depict in photos. We were there for 16 nights and made good use of the clean, modern, well-equipped kitchen. There were a couple of technical issues upon our arrival and they were handled quickly and attentively by the management company, Friendly Rentals."
32711,377652,17-07-2011,550342,Louise,The apartment and location was as described - fantastic! it provided us a real living Barcelona experience.  We would definitely recommend.  Nick was a great host.
32711,1999156,16-08-2012,1729029,Johanna,"We had two family's and hired both apartments, the second floor apartment was re furbished rather recently and was very good, the third floor apartment, was still in reasonable shape but desperately needed to have the air conditioning attended too.
Nick was a fantastic host, extremely helpful, assisting us with hiring taxis, suggesting good eating spots and offering advice and help when needed.
The area was good, just far enough from the real action but till near to good restaurants and shopping."
32711,3453278,01-02-2013,2783066,Adele,"Our stay at Nick's apartment was comfortable and perfectly adequate, especially at the January low season price per night.  The apartment was clean and sufficiently furnished.  Nick was prompt responding to questions and he was accommodating.  The issue of the hot water regularly and frequently turning cold needs to be resolved however.  "
32711,3654789,28-02-2013,5001874,Manfred,"Ich war zusammen mit einem Kollegen während des Mobile World Congress in Barcellona drei Tage in diesem Apartement. Es ist zentral gelegen und vom Balkon kann man die Baufortschritte an der Sagarda Familia mitverfolgen. Das Apartment ist super geschnitten und ist topp ausgestattet.Da der Februar für spanische Verhältnisse äußerst kalt war, konnten wir auch die super funktionierende Heizung in der Wohung testen. Das Apartment ist sehr stilvoll eingerichtet und sehr gepflegt. Wer gerne im Web surft, für den ist ein PC in der Wohnung, über den auf das Internetz zugegriffen werden kann. Zum super netten Vermieter Nick Lockie kann man nur sagen, dass er immer erreichbar war und uns behilflich war, wo er nur konnte (Website hidden by Airbnb)"
32711,5013103,07-06-2013,6585212,Annette,"This apartment was perfect for our stay in Barcelona.  It was very close to La Sagrada Familia, and we took that to our advantage.  There were always cabs there to take around the city.  Also, with my limited Spanish, it was an easy location for us to tell cab drivers as a destination.  The apartment was clean and well kept.  It was located on a fairly quiet street in a very busy city, and this was greatly appreciated.
Nick was also an amazing host. He was quick to respond with details and help.  He provided a lot of great recommendations for local places to eat, and we definitely appreciated the advice.
I highly recommend the apartment, and I would easily stay in this place again or in another of Nick's apartments."
32711,7572792,24-09-2013,8641126,Joyce,"Nick is a fantastic host, he really took the time to tell us about the city especially what to avoid.  Do yourself a favor and use his indoor parking spot and save yourself the headaches of street parking on weekdays.  The apartment was very well equipped.  Highly recommend Nick and any of his units."
32711,10568168,25-02-2014,2593745,Andreas,NIck was a very attentive and correct host. Thank you Nick !
32711,21449600,17-10-2014,8368076,Michele,"Nous avons été enchantés par l'apartement et surtout sa situation géographique. Tout près de la Sagrada Familia, dans un quartier très agréable et calme.  Il correspondait à sa description. Un petit bémol toutefois, le grand sofa ainsi que le fauteuil n'étaient pas très propres. Pour le reste, impeccable. A proximité de tout . j'y retournerais sans hésiter."
32711,32275061,16-05-2015,28114790,Domitille,"Notre séjour s'est très bien déroulé, Nick est très accueillant et nous a bien expliqué la situation de l'appartement qui est idéalement situé : boulangerie au pied de l'immeuble, moyennes surfaces à 2 minutes à pied, métro Sagrada Familia à 5 minutes à pied… Le logement était idéal pour deux adultes et deux jeunes enfants et tout à fait conforme aux photos du site, il y avait juste un couchage de plus dans la chambre des enfants. Les deux chambres donnent sur l'arrière et sont donc au calme, le séjour donne sur une rue assez bruyante mais cela ne nous a pas dérangé. Bref, on recommande ce logement."
32711,41615139,08-08-2015,35813556,Tanika,"We had a lovely time in Barcelona and really loved the apartment. It was so conveniently close to the Sagrada Familia and the neighbourhood was very pleasant.  (In fact you could see Sagrada from the balcony). First evening we had a delicious meal in a local restaurant which was very reasonable.  
The apartment was spacious, with a well equipped kitchen and good sized bedrooms. It was very hot and humid in Barcelona but the apartment had great air-conditioning and fans in the bedrooms. All in all, this was perfect for us."
32711,48253465,24-09-2015,33465357,Adam,"Let me start by saying that Nick was an excellent host. We had booked an apartment with another host and upon arrival was informed there was no hot water or internet. We cancelled the reservation and quickly needed to find another place. I saw Nick's place and contacted him. His response was quick and within an hour we were set up in his apartment. Nick was also very informative of the area.

The apartment was clean, spacious, and had everything we needed for an enjoyable stay. Being only a few blocks from Sagrada Familia the location was excellent. Easy access to the metro and a quick ride to all the sights.

I would recommend staying here and can't thank Nick enough for the help we received."
32711,57118231,22-12-2015,44695768,宇一郎,ｻｸﾞﾗﾀﾞﾌｧﾐﾘｱの近辺の割と静かで生活感のあるｱﾊﾟｰﾄでした｡近くにｽｰﾊﾟｰやｶﾌｪも多く､少しゆっくり滞在するには便利な場所だと思います｡(7泊しました｡)お部屋も広いﾘﾋﾞﾝｸﾞと小奇麗なﾍﾞｯﾄﾞﾙｰﾑやｷｯﾁﾝがあり､快適でした｡ﾎｽﾄのNickは対応が早く､非常に感じがよかったです｡3歳と1歳の子供2人を連れていったのですが､近くの公園の情報や子供が病気になった際には病院の情報などをすぐに教えてくれました｡(SMSでやりとりしていましたが､ﾚｽﾎﾟﾝｽは非常に早かったです｡)ｺｽﾄﾊﾟﾌｫｰﾏﾝｽも含めて､全体的に非常に満足しています｡
32711,59631744,13-01-2016,22933065,Carlos,"Nick fue muy amable y flexible ante el cambio de fechas. El apartamento está muy cerca de Sagrada Familia, y hay muchos bares, cafés y supermercados cerca."
32711,71808360,28-04-2016,65789557,Jean François,"Notre hôte est charmant, l'appartement est bien situé, bonne taille pour 4. Un petit rafraichissement pour retrouver le charme des photos et une cafetière classique ou nespresso pour remplacer les vieilles italiennes."
32711,102168640,17-09-2016,53179293,Martin,"A great base five minutes from the Sagrada Familia and metro with small supermarkets bakeries and some restaurants very close by. Flat on 3rd floor, spacious and clean and pretty much as described (just a few tweaks to get it tip top) and we thought very good value. Very comfortable for the two of us. Pre-departure information and service from Nick was excellent - made us very welcome, felt very confident about the whole process. We stayed 12 nights so had plenty of time to explore and relax in the apartment. The flat is so close to the metro and the main sights are just a few short stops away - Old Town, Gothic Quarter, Born, Beach, Eixample but walking even from the flat was never a chore. A short walk to the Hospital de St Pau and St Creu too - definitely one to visit. You are a little away from the busy centre but it's quiet at night despite proximity to Sagrada Familia and Avenida Gaudi Babur some good restaurants close by and self catering would be easy too if you wanted to cook (subject to there being enough crockery/cutlery). No noise from other flats though you can hear your neighbours through the internal atriums but never obtrusive. Good shower with shower curtain over 1/2 bath; washing machine very useful. Towels and bath mats provided - all spotless. Good airconditioning and decent quick wifi. Didn't use the computer but it worked - the TV fine but just French TV we think. The flat we think is excellent value in a smart block with lift, with good metro access to the major attractions - but not in the middle of all the hustle and bustle which was good for us. Happy to recommend. "
32711,122699508,25-12-2016,62409770,Bing,"Nick is a very nice host, he introduced all the details to us and helped us a lot. Besides, the location and facilities of the appartment is also wonderful."
32711,123247537,28-12-2016,73827015,Mona,From day one Nick was very helpful. We appreciated the location and the fact that it was a very quite apartment but efforts should be made towards cleanliness and beds quality. 
32711,125346632,05-01-2017,99077759,Federica,"La ubicación de la casa es inmejorable, puesto que fui con mi familia a Barcelona de turismo!
La casa es grande para estar tres personas de vacaciones. Estuvimos muy bien."
32711,132148560,16-02-2017,111789458,Emmanuelle,"Nick est très accueillant et disponible. Son logement est fidèle aux photos, spacieux et parfait pour une famille de 4 ou 5 personnes. A 7 minutes de l'appartement, il y a un supermarché, au pied de l'immeuble une bonne boulangerie/patisserie, et à 3 minutes, un marchand de fruits et légumes et un joli restaurant 'Singular', kids'friendly avec de très bons tapas et une atmosphère chaleureuse et accueillante ! "
32711,133518207,23-02-2017,110503011,Miriam,El lugar nos pareció muy bueno. El departamento super cómodo y limpio. Además tuvieron muy buena predisposición al permitirnos hacer el check in en forma anticipada al tiempo estipulado.
32711,134070124,26-02-2017,48976003,Suzanne,We loved our stay at Nick's place!! He was very helpful as soon as we booked-- he provided transit advice and was easily reachable when we had questions.  The flat was a beautiful breath of fresh air for broke college kids who usually have to stay in gross hostels.  Would definitely recommend! 
32711,139962817,27-03-2017,27732754,Annika,"In our group we had a lot of changes in arrival times, so I had to change the details of our reservations a lot, which Nick handled great. Our group had two flats in the same building, which was super convenient. The neighborhood is really nice and you can see the sagrada familia from the balcony. "
32711,142254710,07-04-2017,8187528,Anne,appartement agréable pour un séjour en famille
32711,160939237,16-06-2017,732123,Maria,"Está bien localizado, en un buen vecindario, lo único malo es que sólo tiene un aire acondicionado en la sala, y en el verano en las habitaciones traseras hace mucho calor"
32711,173933829,24-07-2017,85458356,Roman,"Great place, perfect location, super friendly, Nick is very helpfull and responds directly if you need anything, I would definietly come back and recomend the place, many thanks Nick."
32711,174602536,26-07-2017,124961743,Marie-Jo,"Accueil bien organisé, très professionnel avec guide virtuel pour visiter Barcelone! Appartement propre et très tranquil à qq minutes à pied de la Sagrada Familia. Super séjour en famille à Barcelone! Le jour de notre départ, nous avons même pu laisser nos valises à l'appartement jusqu'au soir!"
32711,185610396,22-08-2017,3718142,Jeroen,"Nice and comfortable appartment, a bit small for 6 people but it fits and this is logical when staying in Barcelona center.  Convenient connection to the underground and the Sagrada Familia (300m), shops and restaurants all close by. Note that this is quite a distance from the old center, the Ramblas and beaches so for that you need to use public transport or taxi. We especially liked the atmosphere of the appartment which makes you feel like really living in Barcelona between the locals."
32711,191638010,08-09-2017,63656280,Wade,"This apt. Is located 2 blocks from the Sagrada and is a very nice neighbourhood with a local feel. Lots of great tapas bars and restos and markets to choose from and the subway is 5 minutes away. The car noise is a little loud and the apt noise inside the light wells could be annoying sometimes. All in all, it was a great stay."
32711,195670893,20-09-2017,142489152,Efken,Nice apartment with a beautiful of the Sagrada Familia. Near the metro. In a friendly neighborhood.
32711,205443469,22-10-2017,48880307,Jesus,Buena localización. Sitio para dormir. No se corresponde la calidad y el precio.
32711,208365223,01-11-2017,62620882,Carolina,Excelente ubicación. Amplio luminoso y súper limpio. Bien equipado.
32711,208823989,03-11-2017,140753475,Daniel,Flexible and accomodating hosts. Great central location but still nice and quiet. Spacious apartment. Separate toilet and shower which is handy for bigger groups but ambitious to sleep 7.
32711,211181837,12-11-2017,144148441,Pinault,"Logement très bien situé : tous commerces aux alentours, proximité de la Sagrada Familia (300m environ), chambres très calmes (sur cours), sombres (sur cours), salle de séjour (sur rue) très agréable."
32711,214205564,25-11-2017,42996790,Camille,"The location and neighborhood was absolutely fantastic but the apartment itself could have been slightly cleaner. Small things like having toilet paper on hand and a clean fridge, which are easily fixed, would have vastly improved our stay."
32711,217046647,07-12-2017,79160352,Karen,"Comfortable apartment, excellent location, we were very happy with our stay"
32711,220887981,24-12-2017,34841221,Vivienne,"Logement bien situé, supermarché, boulangerie et autres shops à proximité. Hôte très sympa, arrangeant et disponible en cas de soucis, vous renseigne volontiers sur votre séjour et parcours en transport public.Trouve des solutions si soucis il y'a .Appartement convenable ainsi que voisinage.
Recommandé cette location.Merci Nick"
32711,227996140,17-01-2018,13562891,Michal,"Had a great time, the location is excellent! Nick was very responsive and overall we definitely recommend. "
32711,230170729,27-01-2018,11204817,Pavel,Huge and good flat for a family or big company. Walking distance from the metro and very close to Sagrada Familia. Excellent equipped kitchen.
32711,232519617,05-02-2018,455512,Sandra,Nick's place is located two blocks from Sagrada familia and the metro stop by it so very convenient. There are also many supermarkets nearby. The place also has a spacious living room/dining room to hang out in.
32711,237052459,21-02-2018,29250574,Yao,"很棒的地點,可以走到聖家堂､聖保羅醫院,附近有很多超市跟店,房間乾淨舒適,大客廳和好用的廚房,讓我們一家人每天都一起開心吃早餐聊旅行趣事,很棒的地方^^ 
沒有見到Nick,但他們隨時關心我們的需要及回覆問題,唯有因是老房子隔音不好,有一晚住樓下的中國人很吵鬧｡"
32711,246406654,25-03-2018,179604437,Axel,"Buena zona, todo limpio, muy bien calidad vs precio"
32711,260605018,04-05-2018,26954298,Gwenola,Appartement à 2mn à pied de la sagrada et du métro dans un quartier vivant et populaire.
32711,289901036,13-07-2018,8116,Sara,"We had a blast! Everything is so near! Loved being able to see the Sagrada Familia from our balcony and enjoy a typical barcelonian neighborhood. 
Nick and Ludmilla are very nice and attended our needs right away. "
32711,307793142,15-08-2018,88885245,Aurélien,"Appartement conforme à nos attentes, très bien placé!
Nous avons pu profiter pleinement de nos vacances, la communication à été parfaite et quasi instantanée entre l’hôte et le voyageur.
Un grand merci pour tout!
A bientôt"
32711,311788399,22-08-2018,209431544,Diana Marcela,"El piso de Nick es genial. Sales al balcón y  ¡boom!: la Sagrada Familia. Excelente ubicación difícil de mejorar. 

El alojamiento estaba limpio y en buenas condiciones. Todo estaba correcto y es muy probable que repitamos en una próxima visita a la ciudad.

Recomendable sin duda.

Diana y Josué"
32711,338657131,20-10-2018,6343376,Femke,"Location, location, location! The location was great. It was very near the sagrada, the metro station and on walking distance from parq quelle. It s a pitty that it was a commercial company who rent out the place.We had to sign an additional agreement. Further we were disturbed by a cleaningman who entered our appartement with hos key without notice. So no colour locale."
32711,341589228,27-10-2018,220796794,William,"Cozy apartment, beautiful balcony view, and in great location for such value! I would stay here again!"
34981,110535,03-10-2010,44341,Simon,"Beautiful apartment, perfectly located with everything close by. apartment was clean, had everything we needed. 

Daiga was kind enough to let us put our bags in one of the rooms early in the day before the previous renters were gone. Recommend this place to anyone who travels to Barcelona"
34981,127480,26-10-2010,211160,Susan,"My apartment was changed to another a few days before my trip. Therefore, I did not stay in this one. "
34981,164899,04-01-2011,259910,Emelie,"We had a lovely stay at this apartment. It was spacious, clean, and all amenities promised were provided. Bathrooms are very newly renovated (although only 2 out of the advertised 3 were ready for use at the time of our stay). Location is perfect - very central, just off Plaza Reial, and within walking distance to many shops, restaurants, bars, and the beach. The only downside of this location is that the rooms closest to the kitchen have windows overlooking a busy street, which can be quite noisy at night. Overall, we can recommend this apartment."
34981,168792,10-01-2011,306375,Jenny,The accommodation was perfect for a group of people. Very central and right near many of the cubs and bars we had already planned to go. The place is clean and the bedrooms are big. There is no couch but that was OK since we didn't spend much time in the apartment anyway. The apartment also lacks natural sunlight as it is in a very narrow lane way.
34981,325855,21-06-2011,259509,Maria,Great location....excellent and roomy apartment. We had 7 staying in this accomodation and could not of been happier. Daiga met us for check in which was quick and efficient. daiga was very helpful with local knowledge and made our stay carefree and most enjoyable. I would recommend this accomodation to anyone and would happily stay there again. Thanks Daiga :)
34981,361907,09-07-2011,549288,Jill,"The apartment was perfect for our extended family!  The bedrooms were comfortable and the individual air conditioners in each room were a welcome relief from the Barcelona heat.  The location, in the heart of the Barri Gotic was fantastic."
34981,505050,06-09-2011,293031,Zack,My group and I had a stellar time at this location. There were a total of 8 of us and everyone slept comfortably with no noise from the streets. The apartment is safe and clean and the hosts were very kind in helpful once we got there. It's located in a perfect spot right next to great restaurants and in walking distance from all the great spots in Barcelona. I would definitely use their services again.
34981,808784,27-12-2011,1508222,Anastasiya,"The apartment is very good located - just in the center, interior is fine, it is big enough and has separate bathrooms. 
We would like to stress, that our host (manager) VICTORIA was very kind and helpful, she showed real hospitality - explained us where to go, to eat or to relax, and the trip wouldn't be so fantastic without her assistance."
34981,1017259,19-03-2012,100789,Megan,Great apartment for a group of 8 girls on a hens trip!  Central and met all of our needs. 
34981,1103634,09-04-2012,1843741,Galina,"Good apartment  in the center of Barcelona!  only 2 min away from Rambla. We had the whole apartment for us- so it was just perfect. It is clean, rooms are big enough, bathrooms are ok as well - so it is a great place to stay while visiting beautiful Barcelona!"
34981,1162642,22-04-2012,1793866,Abby,"Great location, clean, friendly, comfortable apartment.  Tends to get noisy in the evenings from all the street noise, though we learned to sleep through it.  Everything was clean and lovely and we had a nice stay."
34981,1370585,29-05-2012,147728,Martin,"We had a great time here, perfect place to get back too after exploring the city.

Do not expect to be a guest in somebody's private apartment; this one is fully renovated and equipped to be rented out commercially. This is done in a very professional way and everything you need is there.
We were welcomed by Mara, very friendly and easy to communicate with and she helped us with a solution for our luggage on the last day of our trip.

Ideal location if you are with friends and looking for a nightlife experience because the apartment in in the middle of where all the bars are and in between Plaça Reial and the Ramblas.
(do bring some earplugs if you are a light sleeper). Recommended!"
34981,1502448,18-06-2012,348384,Claudio,"It's a super apartment at a super location. Everything is close by (walking distance).

With 7 friends we had all at hand. Especially the 3 bathrooms were a great asset. 

The apt. is location in a busy street but I have no complaints about the noise. If you keep the windows closed you'll sleep like a rose. 

Lot's of light and small balcony to have a look at strolling people passing by and here the music here and there.

Just around the corner is a very nice bar called Oviso. Perfect for breakfast or lunch."
34981,2296086,15-09-2012,2018517,Wolfgang,"Very good location, only be aware of taxi drivers, they don't want to drop you right at the apartment. The best drop would be plaza real then a few 100 meters to the address. Apartment very clean and safe and all you need, restaurants & shopping, close by. Would book it again.....nice experience, had a good time......

Wolfgang
Canada"
34981,2535722,08-10-2012,2820263,Stephanie,"A lovely apartment in a fantastic location, all 4 rooms were spacious, highly recommended. We would certainly book again."
34981,2630286,16-10-2012,2975182,Sofie,"Very great appartement and an even better location. We stayed there 7 people and with the three bathrooms and spacy kitchen, the place was perfect. The place can definitely be recommended for people, who wants to live in the middle of Barcelona in a huge appartement.
"
34981,2712908,25-10-2012,2139694,Lynne,"Great location, close to lots of restaurants and things to do. Clean and modern, friendly hosts!"
