listing_id,id,date,reviewer_id,reviewer_name,comments
31958,21312112,14-10-2014,10001677,Linda,"This is a lovely, comfortable and very quiet apartment in the non-touristy area of Gracia. I actually chose the place based on the guidebook's description of the area being one of the few neighborhoods left in Barcelona with soul.  At first, my heart sunk when I saw the street where the apartment was located. It looked totally anonymous and charmless. But as we got to know the neighborhood we realized that the  small-town feel touted by the guidebook was correct. People arriving in stores and restaurants were greeted by cashiers and owners like old friends. We saw this many times. Best of all, this friendliness was extended to us! We found a small neighborhood bar/restaurant with a menu only in Catalan, filled with locals, and the owner-cashier-waitress made us feel welcome, explaining every item on the menu in Spanish. On our third visit, she kissed us on both cheeks!
Lina responded quickly to our request for booking, and when, on a Sunday night after 9pm, we had a minor problem, she answered within five minutes by text and email.
A few things to mention: our check-in, by someone other than Lina, was quite rushed. In her defense, she had probably been waiting a long time for us, thinking we were arriving by bus and metro from the airport, rather than the two bus route described in Lina's email. I recommend this apartment, but advise future tenants to try out the key while the person checking you in is present.  We found both keys, especially the downstairs one, to be quirky. 
The bed has a bottom sheet and a duvet, no sheet between you and the duvet. I know this is a common practice in homes, but I think a top sheet that is changed after every visitor would be better.
Also, advertising this as a Gaudi penthouse seems a bit of a stretch. Yes, it has a wonderful view from the terrace, which includes Sagrada Familia, and is in the neighborhood where many of Gaudi's buildings can be seen, but the building itself was not designed by Gaudi. 
We would still recommend this lovely apartment to someone who wants to experience a more authentic Barcelona...just be sure you can use the key!"
31958,21721642,22-10-2014,22295507,Herbert,alles sehr gut!
31958,22376594,04-11-2014,19501195,Felipe,"Great view, everything as described!"
31958,23263109,27-11-2014,18662281,Wendy,"Excellent welcome lovely apartment and the view was awesome The area was perfect for us 

"
31958,23491537,02-12-2014,21430745,Bulent,Ev super bir yerde. Ulasim metro ile cok kolay saglanabiliyor.Yine gidersem bu evde kalabilirim.
31958,30415926,21-04-2015,16484189,Jared,Perfect flat with an incredible view. Close to metro stops but away from the bustle of the city. Definitely recommend!
31958,31895293,11-05-2015,29690230,Yul,"The experience of stay in the apartment is impressive. Located in a quiet district within 15 minutes to the Joanic metro station. The penthouse is clean, well-equipped with electrical machines. We still have an unforgettable memory of the big terrace, a bird-eye-view over the whole city. "
31958,32919221,23-05-2015,12923404,Anne-Mette,It was so nice to stay in this flat again 
31958,33188817,25-05-2015,16228243,Goran,Excellent apartment with a fantastic terrace and view. Service: great! Highly recommended !
31958,33912876,02-06-2015,6976724,Tom,"Great hosts, we called them up 45 minutes before arriving at the apartment and they came to meet us. Gave us lots of helpful tips on Barcelona, a map and a welcome pack giving details of the apartment/local area. Everything was very clean and tidy, and the views from the terrace were spectacular. We had a great time here.
The only slight drawback was that the front door lock was quite difficult to operate - we never got stuck outside, but it often took a couple of minutes to get in."
31958,36091046,25-06-2015,1886304,Claire,"Our experience here was incredible. Luka greeted us when we arrived (even though our flight had been delayed many hours) and showed us around the apartment. He gave us an overview of his favorite spots in the city, which was extremely helpful. The apartment exceeded our expectations and we were absolutely blown away by the view from the terrace. The neighborhood is quiet and, in our experience, feels very safe. If we come back to Barcelona, we would absolutely look into staying here again. "
31958,38392109,15-07-2015,33753674,Stig,Vi blev vel modtaget og vist rundt i lejlighed. Udlejeren havde en mappe som grundigt viste os hvordan tingene fungerede. Mappen havde også masser af gode forslag til restauranter i nabolaget. 
31958,42559197,14-08-2015,6724219,Geoffray,Nice apartment and nice view 
31958,44127658,24-08-2015,24385209,Anna,Awesome is absolutely the best word to describe this penthouse. We had a nice welcome and a good introduction to Barcelona. To sit at the terrass for breakfast and before going to bed was the best with this apartment.  Air con was also appreciated since it was very hot when we visited. We highly recommend to stay here and we would love to stay there again. The neighbourhood was quiet with a grocery close by. 
31958,48349163,25-09-2015,8990335,Fern,"You can tell that this place is used solely for rentals, a bit rundown. 2 lights didn't work.  The patio and view of Sagrada Familia were the highlight. The neighborhood was pleasant except for the road construction."
31958,48898479,29-09-2015,16595680,Jean-Luc,Great flat in a great location. Gracia is the best area to stay in Barcelone with heaps of little cafes and restaurants for tapas. The apartment is very comfortable and we loved having breakfast in the sun while looking over the city. We would definitely stay there again! 
31958,49994075,08-10-2015,41100956,Brian,"First of all, as advertised, the views were incredible!  We enjoyed our stay in the apartment and found it very comfortable.  Marina was helpful in showing us around the apartment, giving us restaurant and site recommendations, and helping us orient to the neighborhood.  We liked the location as well, which is a bit outside of the ""touristy"" areas, but still very convenient.  As mentioned in other reviews, the locks were really tricky.  Marina showed us how to use them, but there were still a few occasions when we were afraid we weren't going to be able to get into the apartment (but it worked out in the end)!   Would  recommend this place to anyone planning a trip to Barcelona. "
31958,50860872,15-10-2015,44391861,Willem Van,"Stayed for one week Oct. 2015. Experience consistent with other reviews. Walking distance to Parc Guell, Sagrada Familia and Hospital de la Santa Creu. Joanic metro 10 min walk, very convenient on yellow line.  Metro easy to navigate (buy 10-trip card). Small grocery stores, bakeries, restaurants all close by (try Tres a la cuina, C/Sant Lluis 35, Gracia;  limited menu but superb food). Quiet neighborhood.  Safe.
Arrived early morning and cd leave bags at apt. at 11 am come back for check-in 3 pm with Marina who was very helpful orienting us to the apt and the city.  Apt as advertised.  Kitchen has all one might need for cooking. Comfortable queen size bed, adequate shower. Lots of natural light.  Very nice terrace. Lift to 6th floor.  Only points with room for improvement: (1) responsiveness to email; and (2) lock to apartment, which definitely needs adjustment.
"
31958,51616669,22-10-2015,18070329,Eduardo,"The view from the apartment was just as epic as we had hoped both from the terrace and the large kitchen windows, quite centrally located and an easy stroll to the subway, the heart of the Gracia neighborhood and the park Guell. Javier met us when we arrived and gave us a very helpful run down on getting around and the location was a perfect home base for exploring beautiful Barcelona. If you are considering this place keep in mind that it is located in a very quiet neighborhood and the terrace is not conducive to any late night partying but still great to sit and chill with a glass of wine, also know that this is very much a vacation rental and not someones home so you will need to make a store run for ALL goods (only a block or so away) and there is no entertainment other than a basic TV so bring a good book and your own CD's as there is no iPod hook up on the stereo, also know there is a washer but no dryer in the apartment, you will need to hang your clothes to dry.  Overall a comfortable, friendly, safe spot and perfect for a couple. "
31958,52081415,26-10-2015,43923281,Nathalie,"Bon accueil de la part de notre hôte. L'appartement propre, très lumineux et agréable a été une ressource d'énergie après de longues balades dans Barcelone...  vue imprenable. 
A recommander."
31958,52991112,03-11-2015,45983721,Karin,Wir hatten eine super Zeit in Linas Apartement. Alles war wie beschrieben. Optimale Lage und ruhige Nachbarschaft. Tolle Terrasse mit herrlichem Blick auf die Sagrada Familia. Wir würden jeder Zeit wieder diese Wohnung buchen. 
31958,54855108,25-11-2015,578301,Rotem,"This is really a great place. 
Looks exactly like advertised, including the view. Amazing sunbathed terrace that was a blessing in the chill of November. The flat itself is very homey, comfortable and welcoming.
Arrival was quick and smooth with all the needed information. 
The area is residential and quiet, with everything you need around, and in a walking distance to more busy areas like Gracia and  Sagrada Familia. If you want to live right in the middle of the busy areas that's not what you'll get. If you want to be outside of the noise but in a well connected location it's a perfect spot. 
One thing to note is that you're asked not to use the terrace between 9pm - 9am. I presume this can be annoying to some if not expected."
31958,55455908,01-12-2015,5812401,Olivia,"We felt very comfortable from the moment we arrived at the apartment. It was clean, spacious and had a lot of light.
Needless to say that the terrasse is the highlight of the apartment. With its spectacular view over the city!
The neighborhood Gracia is super mellow and local, away from all the tourist masses but still close to everything you would possibly need.
I would highly recommend this apartment and will come back too :)"
31958,59306527,09-01-2016,17554633,Enrique,"The apt. was great, neat and homey. The interaction with the managers was great, prompt and very responsive. The area is both, well situated from everything you might want as a tourist as well as away from the dense tourist traps. Thanks for a great lodging experience! Very recommended."
31958,62535166,15-02-2016,320897,Henrik,"Great flat, no complains! Became my default Barcelona holiday home!  "
31958,64376659,03-03-2016,19053894,Jonas,"We had a great stay in Gracia and the apartment, the roof terrace is amazing! 
Thanks"
31958,67074298,26-03-2016,1836902,Meghan,"Lina and Marina's apartment was a beautiful space in a great location. Everything was exactly as the pictures suggest, they were punctual when it came to the check-in and check-out and the view can't get any better! Thanks for opening up your house to us."
31958,67511267,29-03-2016,5157376,Isabelle,"On a énormément apprécié l'appartement de Lina et Marina, très lumineux et calme, avec une terrasse qui domine toute la ville. On ne regrette pas ce choix. Nous y reviendrons si l'occasion se présente."
31958,68415107,04-04-2016,60851180,Margarita,"The apartment is very nice. The view from terrace is breathtaking especially at the sunset. You have a view on Sagrada Familia and on hills with castle (really amazing). During the day you can have vitamin D by sunbathing and relaxing on the terrace.

The area is nice, in walking distance from cozy restaurants and bars. Metro stations are nearby. We walked to the city centre from the apartment enjoying good weather and views in an hour (moving pretty slow=)).

All in all, we enjoyed our stay woth Lina&Marina"
31958,68921883,07-04-2016,32201781,Margaret,"Marina met us at the apartment and gave us a lot of tips on getting around the city, choosing restaurants, and seeing the sights.  The terrace has wonderful views of the cities and the hills behind the city.  The apartment is well-equipped, comfortable, and quiet.  We liked being a bit removed from the hubbub of the more touristy parts of the city.  "
31958,69695303,12-04-2016,3623651,Mette,"Lovely place with a grand view, Everything worked apart from  some of the lights (bulbs needed changing). My only serious criticism is that the pillows smelled and should be washed or changed. Bring your own pillow if you have a keen sense of smelling!"
31958,70687406,19-04-2016,28200802,Robert,"We loved the apartment  and the warm greet ing we got on arrival together with really great recommendation for places to eat both locally and downtown.
The views are fantastic from the terrace and the rest of the apartment is very comfortable and well placed for the metro and the city sightseeing bus stops just a few meters away. Do try the local bars and restaurants tucked away down narrow streets and into pretty plazas 
Thanks for the bottle of cava to help celebrate our anniversary 
Robert"
31958,71210870,24-04-2016,3288427,Fabrice,"Logement très agréable, fidèle aux photos avec cette vue exceptionnelle sur tout Barcelone"
31958,71924398,29-04-2016,12152557,Ute,We had a great time in Barcelona. The flat had a wonderful view to both sides. All you need for a pleasant stay was available. We can recommend this penthouse.
31958,75319912,20-05-2016,67220168,Beate,"War mit meinem Sohn, 16J, da. Wir haben uns sehr wohl gefühlt.
Das Appartement ist wie auf den Bildern zu sehen, optimal gelegen und sehr gemütlich. Haben uns gut betreut gefühlt und wertvolle Tips erhalten. Ein sehr unkomplizierter und empfehlenswerter Aufenthalt.
Immer wieder gerne!"
31958,76477333,27-05-2016,62185460,Sarah,"This was a very nice, bright, clean apartment to stay in during our time in Barcelona. Well equipped kitchen, comfortable bed, and amazing terrace. The neighborhood itself is outside of the main tourist areas, but still very well connected (5 minutes walk to a metro station) with lots of nice bars and restaurants very close by. "
31958,77231386,30-05-2016,25552138,Liz,"Great place to stay. Very clean. Lovely induction, explaining where everything was. Very close to supermarket. Nice quiet neighbourhood but easy metro to central. Walking distance to park guell. The terrace is amazing!!! "
31958,77771241,03-06-2016,64528898,Ivan,"We had a fantastic time here, communication was excellent, the apartment is stunning, views are just incredible and the sun hits the balcony from early morning to early evening. We would happily stay here again. The location is perfect for seeing the main attractions. It took us less than 30mins to walk in to the centre of barcelona but the metro is a few mins walk and very easy to use otherwise. The Garcia neighbourhood is very nice, some great cafes and restaurants. Thank you very much for a great stay in Barcelona. "
31958,79766374,14-06-2016,35209025,Sascha,"Einfach aber funktional und mit Liebe eingerichtet. Es hat an nichts gefehlt. Empfang war nett. Die Terasse war traumhaft, die Lage nicht ganz zentral aber sonst toll. Nähe zum Parco Güel ist super! Dort kann man hinlaufen oder alternativ mit dem Bus 116 fahren."
31958,81064507,20-06-2016,66136590,Sophia,This was an excellent experience. We felt like this was home. Our host was completely accommodating and made sure we had all the information we needed to navigate the city. We had a wonderful time!! Thank you! 
31958,81619379,24-06-2016,41816871,Laura,"Nice travel thanks to Lina&Marina and this beautiful flat ! The view is awesome and every thing is made to feel at home in the flat ! 
"
31958,82230632,26-06-2016,64799799,Ferg,"Great apartment with a stunning view of the city! Lina was very helpful and met us outside the apartment at short notice due to our flight being cancelled. 
Would definitely recommend!"
31958,83097589,01-07-2016,64568259,Chi Hin,"The apartment is on the roof floor so it gives you an amazing view to Barcelona city. Downstairs of the apartment you can find bakeries, supermarkets and restaurants. Metro is around 10 mins walk, instead there are bus station which is just 2 mins walk and it will take you to the city center and all the attractions."
31958,84284021,06-07-2016,2811368,Robin,"Would I stay here again? Honestly, I'm not sure. There were pros and cons. 

Pros: The deck was AWESOME - amazing view of the city and a great place to enjoy a nice glass of wine and conversation. 

Cons: This place was pretty dirty. It seemed like our bed linens hadn't been washed (there was sand everywhere?) and I found a dead spider stuck to the bottom of my pillow - really gross. Also, ants in the bathroom and bedroom. Not a TON - but definitely a noticeable amount. "
31958,95630838,20-08-2016,76665321,Judy,"My friend & I stayed at Lina & Marinas for 5 nights. It was good having the deck to relax on and is in a quiet neighbourhood. Cafe & supermarket close by and very close (walking distance- 20 mins maybe less)to Park Guell & the Basillica Sagrada de Familiar. Although we did not meet Lina & Marina we had a helpful friend of theirs called David who helped us settle in., but apart from the initial greeting their was no interaction with the hosts. There are 2 double beds but one is a couch bed and the apartment is clean and serviced by a lift. We had a good stay."
31958,98006706,29-08-2016,62287986,Raffaella,"The perfect Barcelona apartment! It's in walking distance/ on the metro line that goes to many of the places you'll want to visit, and the large size, good facilities and terrace means you'll want to spend time relaxing in the apartment and enjoying the sun there too! The best place I've stayed in Barcelona! Although this is clearly stated in the rules so no reason for complaint, be aware that you will be charged the late arrival fee if you are only 5 mins later than 9pm so a top tip is try and arrive on time!"
31958,98509175,31-08-2016,85520535,Aliya,"Had an excellent stay. The apartment had great views of Barcelona and the terrace was particularly lovely. 
It was very clean and the essentials provided (towels, duvets, extra pillows etc) were great. The kitchen was very well equipped allowing us to cook with ease. 
The location was relatively far from the centre. It was about a 7-10 minute walk to the nearest metro station, but it was quite easy to reach all the touristic attractions using public transport. It was however walking distance from Guell Park which was nice! 
Overall, I would highly recommend this apartment."
31958,99816047,06-09-2016,73377598,Juan,"Estuvimos muy contentos de quedarnos en este apartamento, es un lugar muy limpio y cómodo. Además la vista a la ciudad es preciosa!"
31958,101198252,12-09-2016,15053047,Jimmy,The apartment is great and the view from the terrace is amazing!! 
31958,104093545,25-09-2016,4211671,Chris,"Enjoyed our stay, thanks! "
31958,104370290,26-09-2016,27684908,Gabija,"Nicely situated in pretty quiet area, in between of Sagrada and Park Guell. The apartment is simple, but clean and the view from the terrace is stunning! Host was very helpful with map and recommendations about the city."
31958,105919321,03-10-2016,13137889,Yvonne,"Cannot fault this place.  The view is spectacular and really makes the apartment special - was the perfect spot to watch the sun go down with a glass of wine and see Barcelona spring to life at night.  

The apartment is basic, but clean and has everything you need - it's a perfect sized space for a couple.  Gracia is a fantastic area, and you are minutes from anything you need, including transport.  Great restaurants, spaces and bars and you are out of the tourist trap areas.  We ended up spending most of our time in Gracia as it felt so local.

Our flight was delayed 12 hours and we were met at 1am at the apartment by David, which was entirely reassuring.  We were in touch with Lina during the day re our flight delay and apartment check in times, and replies were pretty much instant. David gave us the run down of the area which was great, despite it being 1am!  

I wouldn't hesitate to book here again.  Missing the view already!

"
31958,107787513,12-10-2016,43881852,Rowland,We really enjoyed our stay in this apartment. The location was good - within walking distance of Gracia and Park Guell. Joanic metro station was quite close (5 minute walk). The apartment was very comfortable and had everything we needed. The views from the terrace gave the apartment a wow factor which put the icing on the cake. To sum up - exactly what we wanted. Thank you Lina&Marina
31958,110723716,28-10-2016,50348743,Marina,"
The location, near Park Güell is an asset. The proximity of the metro too. Unique small apartment on the top floor, the terrace and the view are very nice; simple and comfortable, the apartment now seems destined mainly for rent. The organization of the reception is precise and efficient. In short, a very pleasant stay.
"
31958,112222130,04-11-2016,92120404,Andrea,"Mein Sohn (16) und ich haben uns im Apartment sehr wohl gefühlt. Für unsere Bedürfnisse war alles da, was wir brauchten. Dank des guten Wetters konnten wir auf der herrlichen Terrasse unsere Mahlzeiten einnehmen, aber auch tagsüber die Sonnenliegen nutzen. Die Gastgeberin hat uns freundlich empfangen und gute Tipps gegeben.
Es gibt sogar einen CD-Player und eine Auswahl an CDs dort.
Es ist wunderbar hell im Apartment und die Aussicht nach drei Seiten(!) wirklich etwas Besonderes. Zu viert hätte ich es vermutlich als etwas eng empfunden, aber zu zweit war es prima. Ich würde sehr gerne wiederkommen!"
31958,114551090,19-11-2016,46910311,Jacques,Nous avons apprécié après de longues marches et visites de trouver le calme et le repos dans l'appartement  bien équipé et fonctionnel de LINA et MARINA.
31958,115476633,25-11-2016,33102036,Samuel,"Cosy, clean and with a priceless view"
31958,116178413,28-11-2016,18793392,Evelin,"Our host was amazing, she was very professional, recommended us many places to go, also informed us about stuff we have to be aware and go on.
The apartment was fabolous! The view is unreal! Next time when I visit Barcelona, I'm sure I'm gonna stay here again, best area of the city! Very well recommended!!"
31958,120043551,07-12-2016,11075735,Alex,"The flat was really great! The location was perfect; really easy to get around the city both walking and close to metro and bus services. The photos of the inside are accurate, but they really don't do the balcony and view justice, it's insane!! Communication prior to arrival was good and we were met by a friend of the hosts who was super friendly and had loads of recommendations and advice. Would definitely recommend! "
31958,121455939,17-12-2016,33801177,Marie-Noelle,"Logement conforme à la description, spacieux, propre et très calme. En résumé : fantastique : )
Merci !"
31958,122261250,22-12-2016,25073044,Nina,"The apartment was as described. We enjoyed our stay. Unfortunately, a storm hit Barcelona and we could not fully appreciate the terrace which offers great views of the city. Although a little out of the way, public transportation is easy to navigate the city. We also appreciated Roger who helped us to check in. He gave us all the information about the apartment and about the city. It was a pleasure to talk with him. "
31958,125317473,05-01-2017,16033117,Tibor,"The apartment is good, the view is amazing.
Communication on arrival was a little bit difficult: the guy that answered the phone hung up on us the first 2 times we called.

I don't now if 'Lina y Marina' exist, this apartment is rented by a company Barcelona apartments. This is the only disappointment: it's not clear from the advertisement that this is a company.

No shower supplies.
"
31958,125924225,08-01-2017,51874774,Matt,Great place to stay
31958,126607805,13-01-2017,49913041,채원,"숙소는 역에서 10분가량 떨어져있고 숙소가는 길에 빵집과 슈퍼마켓이 많아 먹거리를 충분히 사실 수 있습니다. 아파트는 매우 깨끗하고 넓었으며 침실에서 본 뷰는 매우 훌륭합니다. 화장실과 주방 모두 사용하는데 불편함이 없었으며, 숙소에 엘레베이터가 있어 오르내리는데 편했습니다. 

The accommodation is about 10 minutes away from the station and there are many bakery and supermarkets on the way so you can buy enough food.The apartment is very clean and spacious and the view from the bedroom is very good.Both toilets and kitchens were comfortable. There is an elevator that is useful."
31958,130487976,06-02-2017,82734114,Dan,A great place and a great host !
31958,133249216,21-02-2017,5590462,Ariana,"The apartment is in a great location - very close to multiple subway lines, and to great restaurants and cafes. It is also walkable to the center of the city (if you are up for a long, but beautiful, walk!). The views from the apartment are remarkable, the deck is huge and overlooks the whole city. The amenities are basic - no kitchen basics, soap, or toothpaste, but the location and the apartment itself make up for whatever is missing. Comfortable, convenient, and clean."
31958,135122721,03-03-2017,39580843,Matthias,"Great terrace! Spacious bedroom. A bit far our, but good connection to subway."
31958,137391461,15-03-2017,57279192,M,Ubicado es el barrio de Gracia. Lejos de toda atracción turística. Sobres tico un piso por escalera. TV pequeña. 
31958,138890088,22-03-2017,117441706,Anne,"Séjour agréable, appartement confortable, très bien situé. On s'est senti comme à la maison !"
