listing_id,id,date,reviewer_id,reviewer_name,comments
35379,39809530,26-07-2015,37229425,Jen (Joo Young),"Pablo has been an amazing host! We stayed for a full week and I don't think we could have found a better option :) Pablo has been incredibly hospitable, always around to help us out if we needed anything. Would highly recommend."
35379,40596502,01-08-2015,35050509,Maria Letizia,Posto facilmente raggiungibile con i mezzi di trasporto e in pochi minuti si è in centro. Il posto è carino e ben tenuto. Pablo è stato fin da subito molto disponibile nei nostri confronti
35379,41366445,07-08-2015,35148083,Kristina,"We stay 4 days at Pablo’s house. Location is not so attractive, it is a long street with buildings and few bars, but it is close to the metro station. As we arrived quite late at night, there was no problem with accommodation, as Pablo was waiting for us. He give us all important information for the apartment which was looking same as we saw it on the pictures. Two bathrooms were always available for us, even though all house was fully booked. Pablo was always there to help with anything, he lives in the apartment downstairs. He also allow us late check out. Thank you Pablo."
35379,42316571,12-08-2015,39413881,Raphaëlle,AirBnb au top ! On se sent comme à la maison ; l'appartement est très propre et design. Merci Pablo ! Nous reviendrons.
35379,44675392,28-08-2015,31605738,Damian,"Nice room in a very good location. Close to the metro station and some of the most interesting attractions (Sagrada Familia, La Rambla)."
35379,45139647,31-08-2015,40612155,Mathilde,"Nous avons passées un très bon weekend à Barcelone où nous avons logées chez Pablo. Celui ci est très accueillant, très arrangeant également. La chambre et les locaux sont propres et les photos correspondent à la réalité. Tout est fait pour que l'on sente bien. Je recommande vivement!!"
35379,48019862,22-09-2015,43169401,Jonathan,"My girlfriend and I had a great stay at Pablo's flat. It is very well situated, the metro station is 2 minutes away from the flat but we were also able to see many things by foot. The description of the apartment is correct and the rooms look like on the pictures. Pablo was very welcoming although we didn't see much of him during our 3-days stay. All in all a great weekend, we recommend !"
35379,49527189,04-10-2015,37305626,Teresita Alejandra,"Fuè nuestra primera experiencia en airbnb y superó nuestras expectativas.
Pablo es una persona encantandora, amable y atento a todo detalle para que nuestra estadia fuera cómoda y confortable. 
Quisiera destacar la exquisitez en todo el diseño, armonia y mantenimiento del piso, fué un gusto alojarse aqui. 
El barrio del eixample es un barrio tranquilo y familiar, con todos los servicios cerca, la estación de metro queda a una cuadra del departamento, y se puede llegar desde aqui a todos lados caminando. Repetiriamos la elección."
35379,50543738,12-10-2015,45372452,Nicolas,"Très bon séjour dans la résidence de Pablo, par ailleurs très serviable, aimable et disponible. La description et les photos correspondent à la réalité. Chambre et parties communes propres et fonctionnelles. A recommander"
35379,63722456,26-02-2016,27881970,Marjan,"Pablo was of great help. He is always available. The apartment is very close to metro 2 min. There is McDonalds 2 min away next to the metro, other restaurants bars etc. The apartment is clean every room has own privacy, key, tv great and fast wireless internet. There are two identical bathrooms. Very clean. The kitchen is with full equipment and there is good breakfast. I would totally recommend the place."
35379,67730461,30-03-2016,63689985,Fiona,"pablo非常热情,人特别好,旅行期间在住宿方面我们一点儿后顾之忧都没有,我们中有人有不舒服房东还帮忙给找了药｡房间和图上的一样,非常好,电视电脑都有,厨房也很方便,卫生间有两个｡最好的一点是周围特别安静,晚上休息得特别好｡地理位置也很好,去地铁站分分钟就到了,到米拉之家或者巴特罗之家走路也只要十几分钟｡总而言之是一次完全美好的体验｡"
35379,71682137,27-04-2016,12665235,Ezequiel,"Lindo lugar, igual que en las fotos!
Solo 2 cosas:
1- pudimos hacer el check in a las 19 hs recién, cuando vienes de viaje con las valijas, cansado no es nada agradable, inicialmente le pedimos a Pablo si podíamos dejar las valijas a las 12 am, no había problema, lamentablemente el vuelo se retraso 1 hora y no pudieron esperarnos, finalmente volvieron a las 19 hs, anduvimos paseando con las valijas por Barcelona! por lo menos podrían haber estado a la hora del anuncio 15:00 hs
2- el edificio estaba en obra hace varios meses, nos levantamos 8.30 am con ruidos de maquinas de todo tipo, deberían aclarar en el aviso esta situación, si hubiera sabido no lo contrataba,ya que me gusta descansar en mis vocaciones, Pablo nos pidió perdón, ya era tarde hubiera preferido que nos avisen antes!"
35379,72655262,04-05-2016,18450687,Sonia,"Estuvimos dos dias alojados en casa de Pablo y genial. La habitación y la casa genial, muy bonita y con servicios que necesitamos. La muy céntrica. Agradecemos la acogida y la simpatía que recibimos. Muchas gracias. "
35379,74937346,17-05-2016,30263890,Lena,"We didn't meet Pablo because he was away. Therefore Mario welcomed us and answered all our questions.
The flat is equipped with everything you need. There are four rooms and two bathrooms and the kitchen. 
There was a small breakfast in the kitchen (toast with jam and coffee/tea) every morning which we liked very much.
We could leave our luggage in the appartment even though we already checked out. That was really nice!
Also the communication with Pablo in advance was very uncomplicated and fast. The same with Mario during our stay.
The only thing that wasn't perfect is that the flat is badly soundproofed because the doors were quite loud. For us it wasn't a big deal but I assume that sensitive people would appreciate a more quiet room. "
35379,75873095,23-05-2016,66812592,Nora Beatriz,Pablo noos brindo alojamiento en un apartamento ordenado y limpio ubicdo en un excelente barrio de Barcelona.
35379,76418242,27-05-2016,71874843,Jeanette,Pablo was a great host :) The room was really comfortable and the location was amazing. It was convenient to get to different parts of Barcelona. My friend and I really enjoyed staying at his bnb~
35379,77952025,04-06-2016,36231224,Mariana,"The place was clean and comfortable, quiet and everything was as described. The neighborhood was perfect for us since it was close to everything and it also made us feel as we were living in the city! Lots of great cafes and restaurants around the b and b."
35379,79127001,11-06-2016,68794123,Spela,"Pablo was a great host. He gave us all instructions around Barcelona, showed us tips and tricks and was kind enough to also print our boarding tickets on our return.

The apartment is very near the metro, so its easy to get around.

We will definitely come back. This was good price for value!"
35379,80039607,15-06-2016,22963584,Gigi,El cuarto es tal cual se publica en las fotos. Llegamos en la madrugada y Pablo no tuvo inconvenientes en recibirnos a esa hora. Tiene una estación de metro muy cerquita que permite hacer las conexiones que uno quiere. Recomendable! 
35379,80522658,18-06-2016,67374844,Beatrice,"Pablo était souriant, chaleureux et vraiment sympathique. On s'est senti bien accueillis !  Parlant pas trop mal le français il a bien parlé avec nous. Il était disponible pour tout renseignement dont nous pourrions avoir besoin.  L'appartement était bien, correct et plutôt bien situé dans la ville de Barcelonne. Pour être honnête nous le recommandons tout à fait.  Merci merci Pablo

Béatrice et Jérôme Rouillé"
35379,83659250,03-07-2016,63011532,Victoria,"Pablo es un excelente anfitrión.  Desde el momento de nuestra llegada fué muy atento, amable, servicial y siempre dispuesto a ayudarnos en todo lo que necesitamos.  El apartamento es todo lo que me esperaba y más, ordenado, limpio, acogedor y con lo necesario para sentirse como en casa. Realmente nos sentimos muy cómodos. La ubicación me fascinó, el barrio es precioso y todo queda cerca, restaurantes, bares, farmacias, tiendas, supermercados, fruterías, lavandería, transporte público, el centro de la ciudad a pocas calles, en fin todos los servicios necesarios que el huésped busca cuando permanece de viaje.  Sin lugar a duda, lo recomiendo.  En mi próximo viaje, de seguro me hospedaré nuevamente en este lugar. 
  "
35379,85955982,14-07-2016,71605062,Marisa,"Atendiéndome al llegar, enseñándome la casa, dándome sus datos y disponibilidad 24 h para cualquier necesidad..."
35379,86473738,16-07-2016,48300282,Sergei,"We really enjoyed our stay in Pablo's apartment. Pablo himself was really nice and friendly, he did everything to make our stay comfortable and we really appreciate that!"
35379,87341739,19-07-2016,74941541,Mn,"Pablo is definitely a great host: available on phone, present in person the day of our arrival and on top of that he speaks french :)

The room is private and the bathrooms are very clean.
Also the kitchen with the breakfast basics was a great addition. 
We enjoyed our stay. Thanks Pablo."
35379,88972304,26-07-2016,76407843,Mouhcine,"Le logement est exactement comme il est décrit dans l'annonce,Pablo est accueillant et est présent pour répondre à nos questions.
Situé près des transports en commun.
Nous avons passé un agréable séjour ! "
35379,89773355,30-07-2016,75551554,Thalie,L'appartement est idéalement situé et spacieux. Pablo est très arrangeant et sympathique. Il nous a conseillé pleins de bonnes adresses. Le rapport qualité/prix est plus que satisfaisant. Je recommande fortement. 
35379,91113132,03-08-2016,13637149,Martin,"We can highly recommend staying at Pablo's place. It is a apartment only with airbnb rooms and two bathrooms. There is also a computer which can be used. Pablo is a great host who lives downstairs and is super helpful at any time. He welcomed us very friendly, provided us with useful information about the city, nice things for breakfast and towels. The flat is tidy and clean and we could use the kitchen and at any time."
35379,92288835,08-08-2016,21452675,Peter,"We stayed for 4 nights here. The apartement is well located, clean and comfortable. We had everything we needed. Pablo is a professional host, speaks good english, helps in every way he can."
35379,95691031,20-08-2016,83713919,Nick,De verhuurde was zeer vriendelijk. Onze koffer werd direct naar boven gedragen en alles was mooi uitegeld. Een top-verblijf.
35379,96724788,24-08-2016,36595443,Esta,"Pablo was the perfect host! He is very professional at hosting people. Available, helpful and responsibly. The apartment is like a private hostel and had everything we needed :) Like a basic breakfast with toast, jellys and good coffee. Pablo took extra care of the security of the rooms and the apartment, so we felt really safe. The location is close to a metro station, but also by foot it is easy to go sightseeing. We would definitely recommend the apartment and come back! :)"
35379,102722199,18-09-2016,79131117,Luis Eduardo,Gracias Pablo. Excelente servicio. Justo lo que necesitábamos.
35379,103350253,22-09-2016,71939195,Laura,"It was very nice at pablo's! Everything we needed was already there and Pablo was always there to answer questions or  to give us Information. We had a computer that we could use all the time which was also very comfortable.
There were some craftsmen in front of our window but it did not influence our stay.
Thank you Pablo, we would be glad to come back!"
35379,104665238,27-09-2016,86071873,Jess,"I had a great 5 night stay at Pablo's place! He was a great host and the room and apartment were just as they were in the photos. Great location-easy to get the metro to the beach and other attractions. Fruit, bread butter and other essentials were a great addition. "
35379,105421539,01-10-2016,70201743,Tatiana,"Пабло был замечательным хозяином. Он сделал все, чтоб наше пребывание было комфортным, предоставил нам больше удобств, чем было заявлено в описании. Очень чисто, квартира оформлена с большим вкусом, в ней все есть, хороший спокойный район, близкий к достопримечательностям. Замечательно, что был общий компьютер, карты, удобная кухня и  продукты к завтраку (вечером возвращались поздно и не всегда успевали зайти в магазин, а утром нас ждали тосты, фрукты и кофе). Мне кажется, что благодаря проживанию в этих апартаментах, мы смогли так хорошо посмотреть город."
35379,106628841,07-10-2016,83147658,Scott,"Pablo was a great host and always made himself available in case anything was needed. The room we stayed in was well-appointed, updated, had good storage, a comfy bed and even a balcony. The room was on the smaller side but we didn't spend very much time in it anyway. The bathrooms are very nice and always kept clean. The kitchen has everything you could possibly need for cooking and he even keeps breakfast items, including coffee (very important) well-stocked for everyone staying there. Pablo even made an extra effort to help us print boarding passes for our flight home which was very kind of him. We were very happy with our stay here and would gladly come back again. Thank you Pablo!"
35379,108467499,16-10-2016,24455287,Sara,"Pablo is a great host! Always available to accommodate our needs, super flexible when we asked him to please keep our bags until later the day of our check out! The flat is very clean, and has everything you need for your stay. Location is also very good, quiet yet not far from the center by walking, or if feeling lazy the metro is 2 min away! When I ll go back to Barcelona I ll stay here again! :) "
35379,109081785,19-10-2016,90942330,Paulina,"Un excelente b&b, muy cómodo y limpio.
La ubicación muy buena, y Pablo es un excelente anfitrión.
Nos encantó!"
35379,109588699,22-10-2016,39733245,Rafael,"Todo genial, Pablo siempre estuvo a disposición para ayudarnos en todo.
Volveríamos a hospedarnos sin dudarlo. Gracias!"
35379,110098783,24-10-2016,5239760,Michael,"Pablo was a lovely, accommodating host and his apartment hostel was a great base to explore the city. Pablo has renovated the old apartment and our room was very clean, had plenty of storage space and a very comfortable bed. Also, the kitchen is very nice and breakfast was provided. The apartment is convenient to the L5 metro and Sants Estacion and we spent most of our time exploring the city on the train and on foot. Wish we could have stayed longer!"
35379,111056225,29-10-2016,6283694,Smit,"Pablo is a very jovial man with whom one can enjoy talking. His house is in the modern extension of Barcelona, where one can see modern architecture in bounty.  The house is near the metro station, which makes travel very convenient. The house is very well equipped with a kitchen where one can store and cook food. The host Pablo is available all throughout the day as he works and lives in the same apartment."
35379,114273832,17-11-2016,14159029,Iván,The location was close to public transportation and in a nice neighbourhood. Pablo was very friendly and when we needed help he was always very fast to answer. No luxury but everything what you need for a city holiday.
35379,115517160,25-11-2016,98411073,Thomas,"Hi Pablo,

back again in Germany. I had a nice stay at your home and would like to come back next year! Highly recommended!"
35379,116414128,30-11-2016,65092055,Sam,"Pablo is a wonderful host. He welcomed us at the door and showed us around, answering our questions attentively and making us feel comfortable. The apartment is modern, stylish, and well designed with some charm and character. Two showers, definitely a plus. Relaxing balcony with a view of the inside of the superblock. It's in a lively, safe neighborhood with all the shops you could want, including scooter rental (probably a 10-minute walk) and bicycle rental (a little longer, but on the way into town - beautiful walk that feels shorter than it is!). My brother and I had a wonderful time during our two nights there and would come back!"
35379,120039656,07-12-2016,45739117,Catherine,"Pablo is a great host, very communicative and makes you feel welcome and he is totally available to help with any queries. The flat is near the tube in a nice location. The room was comfortable, with a balcony. Pablo leaves fresh coffee and basic breakfast making stuff in the fridge, he makes sure everything is there for his guests. Recommended."
35379,120284838,09-12-2016,65004238,Lidwine,"Pablo est un hote excellent ,  c'est un logement à recommander"
35379,120600263,11-12-2016,89204630,Carla,Es un lugar muy bueno para hospedarse cuando vas a Barcelona de turismo ya que esta situado cerca de una parada de metro. 
35379,121088080,14-12-2016,97476579,Meredith,Pablo es muy amistoso y el piso es cómodo y limpio. ¡Regresaré pronto!
35379,121449711,17-12-2016,85430212,Livingstone,This was a great place to stay and Pablo was extremely helpful with anything we needed. Everything was clean and neat and tidy.
35379,121814070,19-12-2016,71911952,Marie-Cécile,Hôte très accueillant et chaleureux. Très bon Rapport qualité prix. Logement facilement accessible en transport en commun.
35379,122247185,22-12-2016,63792971,Louise,"Pablo nous a très bien reçu, simplement : il est très accueillant et très souriant. Nous recommandons à tous de venir tenter l'expérience dans cet appartement à la fois beau, bien entretenu et très agréable : nous nous sommes senties comme à la maison ! "
35379,123690388,30-12-2016,61611431,Cecelia,Pablo is the most friendly host! He is available most of the time and is always willing to help! The place we stayed was very clean and nice. It has a fully equipped kitchen and 2 bathrooms. Everything will be prefect if you have respectful neighbors. But I suggest to bring earplugs just in case!
35379,125507524,06-01-2017,40821395,Jorge,"This place was very suitable for our trip, great location, great host and even offered us a small breakfast."
35379,126939976,15-01-2017,85242513,Yoojin,Hello Pablo! We are so thankful. Going to miss you and Barcelona. God bless you.
35379,127320402,17-01-2017,12052931,Oleksii,"Квартира полностью соответствует описанию на сайте. Центральное расположение жилья позволяет не пользоваться транспортом, а передвигаться по центру города пешком. Мы были в январе, в квартире было немного прохладно. Спасибо Pablo за организацию нашего прибывания."
35379,127815224,21-01-2017,93812669,성욱,"Clients are kind. Location was quite good. But the information they wrote, especially LAUNDRY, isn' same with what they offee."
35379,129331989,30-01-2017,105617601,Romane,"Location idéale (à 4 min à pieds du métro), hôte super accueillant et serviable, appartement propre et agréable !  A recommander ! "
35379,129766577,02-02-2017,46044619,Alberto,Todo muy limpio y como decía la descripción.
35379,130482284,06-02-2017,102966462,Ursulla,Boek deze accommodatie!! Pablo de eigenaar is een bijzonder vriendelijke man. De kamers liggen dichtbij het openbaar vervoer maar het centrum is ook op loopafstand te bereiken. Voor een paar dagen is het een prima verblijf. Pablo is heel behulpzaam en kan je allerlei tips geven als je er om vraagt. Supermarktje in de buurt en bezoek ook Maitea Taberna aan de overkant van de straat! 
35379,131838173,14-02-2017,34520978,Venessa,"Place was in a good location, however about a 20 min walk to the city centre or close to the metro. Fruit and toast and coffee were included. Could be up to 6 people sharing the place 2 full washrooms. There is no ""living space"". All in all a good place to stay just can be a bit cramped if everything is booked. Host was helpful when we had questions."
35379,132165525,16-02-2017,92956520,Juri,"Pablo's place is great. It is not hard to find and is near to everywhere you want to go. The place is not dangerous even at night, and the host, Pablo is nice. He is very opened to every request of people staying thre. Overally recommended."
35379,132462106,18-02-2017,116408250,Carolina,voy a menudo a Barcelona y voy probando diferentes alojamientos...a este volveré. 
35379,133236801,21-02-2017,12547136,Stephane,"Appartement idéalement situé à deux minutes du métro, chambre propre et fonctionnelle, wifi. Pablo qui parle parfaitement français est un hôte accueillant qui saura vous conseiller, de plus il a toujours été disponible et arrangeant. Je recommande cette location."
35379,133550154,23-02-2017,109168020,David,"The place was amazing, affordable and in a great location. Pablo was amazing at helping giving directions and was very nice the entire time. Will definitely stay again if I come back."
35379,134404515,27-02-2017,70976315,Enrico,"Bellissimo alloggio in una posizione centrale e strategica, ben servito da tutti i mezzi pubblici, grazie anche la vicinanza con ospedale. Pablo gentilissimo e cordiale, molto disponibile"
35379,135255807,04-03-2017,72377532,Rocio,"Todo tal cual esta publicado. Pablo fue muy amable con nosotros, nos ayudo con el lavado de ropa y otras cuestiones de organizacion. La zona es muy linda y tranquila, con facil acceso al aeropuerto y a otros lugares de interes en transporte publico. 

Muchas gracias Pablo por tu alojamiento !"
35379,135758128,06-03-2017,15982657,Miriam,"It's such a good accommodation for living for 2 nights. The transportation is well connected around Pablo's place. Even I walked to the city center, just take 25 minutes and 10 minutes by bus. The room is clean and the bed is comfortable. He provided bread and some drinks for breakfast which are nice. There are two share bathrooms and both of them are clean all the time. Everything is good! "
35379,139232259,24-03-2017,31360194,Deni,"La habitación en la cual nos quedamos mi esposo y yo fue increíble. Pablo es un excelente anfitrión, desde la llegada hasta nuestra partida fue súper amable y siempre estuvo pendiente de nosotros. El lugar es perfecto para conocer Barcelona. Super céntrico, cerca del metro. Simplemente fantástico "
35379,140008897,27-03-2017,23154303,Timi,"Comfortable room, great location close to tourists places in Barcelona."
35379,140495000,30-03-2017,14587809,Venkata Narasimha,"It was our first Airbnb booking and Pablo was really a great host! Very central location with easy access to Metro and buses. Neat and tidy rooms. Decent breakfast. Being an Indian, living in Europe for many years we were even delighted to have restaurant Sindur just beside. It was a short stay of 2 days yet one of the best and we will definitely stay at Pablo's in our next visit soon..."
35379,141165986,02-04-2017,52738635,Cédric,"Pablo is a very nice person and the place, which is a bed and breakfast, is easy to reach by public transport. "
35379,142031556,06-04-2017,59444131,Sophie,"Thank you so much for a lovely stay in Barcelona, Pablo! The flat was impeccably clean, and Pablo was a wonderful, very helpful and friendly host. He sees to that the bathrooms are always clean and that there's simple breakfast stuff and coffee & tea as well as fresh fruit available in the kitchen. Highly recommended host!"
35379,142641007,09-04-2017,44716696,Liz,"Pablo家位于安静的居民区,晚上休息很安静,但是离地铁非常近,去任何景点坐地铁就可以了｡公寓有四个房间两个卫生间,pablo人很好,我们晚到还一直等我们,这次住另一个房间有几个其他国家来的年轻人已经住过很多次,说明Pablo的家很方便｡
Pablo is very nice, his home is very quiet, safe and near the metro, we have a nice experience here. There are four bedrooms and two bathrooms. If we have another change to come here, we would choose Pablo's apartment again."
35379,143950286,14-04-2017,112751349,Christy,Pablo is really friendly and helpful. He's place is also comfortable and clean 
35379,145439822,18-04-2017,113861328,Rohan,"Pablo has a very functional place with a mix of single and double bed rooms. The washrooms are shared but again, functional and clean. There's also fruits, juices, coffee, milk, bread and jams provided in the kitchen to ensure that you don't start your mornings on an empty stomach ! The place is conveniently located close to the metro, and is generally a quiet and peaceful area. It's about a 20 min walk from Placa Catalunya, which is great since you're away from the touristy area, but close enough to go in and out as you please. 
Pablo himself is a very sweet and gracious host. He is clear with his communication and helps out wherever he can. As an example, there was an instance in which I had to suit up for a meeting, but had forgotten my belt at home. Pablo immediately understood the seriousness and urgency of the situation, and loaned me his own belt for the time ! Life saver !
I would recommend this place to anyone looking for a decent place at a good price. "
35379,145984103,21-04-2017,33582352,Noemie,"Super séjour : une ville, un logement et un hôte au TOP!!"
